question,answer,options,answer_idx
"An investigator is studying the modification of newly formed polypeptides in plated eukaryotic cells. After the polypeptides are released from the ribosome, a chemically-tagged protein attaches covalently to lysine residues on the polypeptide chain, forming a modified polypeptide. When a barrel-shaped complex is added to the cytoplasm, the modified polypeptide lyses, resulting in individual amino acids and the chemically-tagged proteins. Which of the following post-translational modifications has most likely occurred?",Ubiquitination,"{ ""A"": ""Glycosylation"", ""B"": ""Phosphorylation"", ""C"": ""Carboxylation"", ""D"": ""Ubiquitination"" }",D
"A 38-year-old man presents to his physician with double vision persisting for a week. When he enters the exam room, the physician notes that the patient has a broad-based gait. The man’s wife informs the doctor that he has been an alcoholic for the last 5 years and his consumption of alcohol has increased significantly over the past few months. She also reports that he has become indifferent to his family members over time and is frequently agitated. She also says that his memory has been affected significantly, and when asked about a particular detail, he often recollects it incorrectly, though he insists that his version is the true one. On physical examination, his vital signs are stable, but when the doctor asks him where he is, he seems to be confused. His neurological examination also shows nystagmus. Which of the following options describes the earliest change in the pathophysiology of the central nervous system in this man?",Decreased α-ketoglutarate dehydrogenase activity in astrocytes,"{ ""A"": ""Decreased α-ketoglutarate dehydrogenase activity in astrocytes"", ""B"": ""Increased extracellular concentration of glutamate"", ""C"": ""Increased astrocyte lactate"", ""D"": ""Breakdown of the blood-brain barrier"" }",A
"A 69-year-old man is brought by his son to the emergency department with weakness in his right arm and leg. The man insists that he is fine and blames his son for ""creating panic"". Four hours ago the patient was having tea with his wife when he suddenly dropped his teacup. He has had difficulty moving his right arm since then and cannot walk because his right leg feels stuck. He has a history of hypertension and dyslipidemia, for which he currently takes lisinopril and atorvastatin, respectively. He is allergic to aspirin and peanuts. A computerized tomography (CT) scan shows evidence of an ischemic stroke. Which medication would most likely prevent such attacks in this patient in the future?",Clopidogrel,"{ ""A"": ""Alteplase"", ""B"": ""Urokinase"", ""C"": ""Celecoxib"", ""D"": ""Clopidogrel"" }",D
A 70-year-old man presents to a medical clinic reporting blood in his urine and lower abdominal pain for the past few days. He is also concerned about urinary frequency and urgency. He states that he recently completed a cycle of chemotherapy for non-Hodgkin lymphoma. Which medication in the chemotherapy regimen most likely caused his symptoms?,Cyclophosphamide,"{ ""A"": ""Methotrexate"", ""B"": ""Rituximab"", ""C"": ""Cyclophosphamide"", ""D"": ""Prednisone"" }",C
A 27-year-old man presents to the emergency department after a dog bite. The patient was intoxicated and pulled the dog’s tail while it was eating. The dog belongs to his friend and is back at his friend’s house currently. Physical exam is notable for a dog bite on the patient’s right arm. The wound is irrigated and explored with no retained bodies found. A tetanus vaccination is administered. Which of the following is appropriate management of this patient?,Administer amoxicillin-clavulanic acid,"{ ""A"": ""Administer amoxicillin-clavulanic acid"", ""B"": ""Administer trimethoprim-sulfamethoxazole"", ""C"": ""Close the wound with sutures and discharge the patient"", ""D"": ""Discharge the patient with outpatient follow up"" }",A
"A 19-year-old woman, accompanied by her parents, presents after a one-week history of abnormal behavior, delusions, and unusual aggression. She denies fever, seizures or illicit drug use. Family history is negative for psychiatric illnesses. She was started on risperidone and sent home with her parents. Three days later, she is brought to the emergency department with fever and confusion. She is not verbally responsive. At the hospital, her temperature is 39.8°C (103.6°F), the blood pressure is 100/60 mm Hg, the pulse rate is 102/min, and the respiratory rate is 16/min. She is extremely diaphoretic and appears stiff. She has spontaneous eye-opening but she is not verbally responsive and she is not following commands. Laboratory studies show: Sodium 142 mmol/L Potassium 5.0 mmol/L Creatinine 1.8 mg/dl Calcium 10.4 mg/dl Creatine kinase 9800 U/L White blood cells 14,500/mm3 Hemoglobin 12.9 g/dl Platelets 175,000/mm3 Urinalysis shows protein 1+, hemoglobin 3+ with occasional leukocytes and no red blood casts. What is the best first step in the management of this condition?",Stop risperidone,"{ ""A"": ""Intravenous hydration"", ""B"": ""Paracetamol"", ""C"": ""Stop risperidone"", ""D"": ""Switch risperidone to clozapine"" }",C
"A 35-year-old woman comes to the physician because of a 1-month history of double vision, difficulty climbing stairs, and weakness when trying to brush her hair. She reports that these symptoms are worse after she exercises and disappear after she rests for a few hours. Physical examination shows drooping of her right upper eyelid that worsens when the patient is asked to gaze at the ceiling for 2 minutes. There is diminished motor strength in the upper extremities. The remainder of the examination shows no abnormalities. Which of the following is the most likely diagnosis?",Myasthenia gravis,"{ ""A"": ""Myasthenia gravis"", ""B"": ""Polymyositis"", ""C"": ""Amyotrophic lateral sclerosis"", ""D"": ""Multiple sclerosis"" }",A
A 6-year-old male who recently immigrated to the United States from Asia is admitted to the hospital with dyspnea. Physical exam reveals a gray pseudomembrane in the patient's oropharynx along with lymphadenopathy. The patient develops myocarditis and expires on hospital day 5. Which of the following would have prevented this patient's presentation and decline?,Circulating IgG against AB exotoxin,"{ ""A"": ""Increased CD4+ T cell count"", ""B"": ""Secretory IgA against viral proteins"", ""C"": ""Increased IgM preventing bacterial invasion"", ""D"": ""Circulating IgG against AB exotoxin"" }",D
"A 12-year-old boy who recently emigrated from Pakistan presents with fever, muscle pain, and weakness of the trunk, abdomen, and legs. The patient’s mother says that he has not been vaccinated. Physical examination reveals fasciculation and flaccid paralysis of the lower limbs. A CSF analysis reveals lymphocytosis with normal glucose and protein levels. A throat swab reveals an RNA virus. Which of the following would most likely be destroyed by the virus in this patient?",Anterior horn of the spinal cord,"{ ""A"": ""Posterior horn cells of the spinal cord"", ""B"": ""Myelin sheath of neurons"", ""C"": ""Muscle cells"", ""D"": ""Anterior horn of the spinal cord"" }",D
"A researcher is studying the properties of an enzyme that adds phosphate groups to glucose. She discovers that the enzyme is present in most body tissues and is located in the cytoplasm of the cells expressing the enzyme. She decides to mix this enzyme under subphysiologic conditions with varying levels of glucose in order to determine the kinetic properties of the enzyme. Specifically, she adds increasing levels of glucose at a saturating concentration of phosphate and sees that the rate at which glucose becomes phosphorylated gets faster at higher levels of glucose. She observes that this rate approaches a maximum speed and calls this speed Y. She then determines the concentration of glucose that is needed to make the enzyme function at half the speed Y and calls this concentration X. Which of the following is most likely true about the properties of this enzyme?",Low X and low Y,"{ ""A"": ""High X and high Y"", ""B"": ""High X and low Y"", ""C"": ""Low X and high Y"", ""D"": ""Low X and low Y"" }",D
"A 31-year-old G2P2 female at 40 weeks gestation presents to the hospital following a rush of water that came from her vagina. She is 4 cm dilated and 80% effaced. Fetal heart tracing shows a pulse of 155/min with variable decelerations. About 12 hours after presentation, she gives birth to a 6 lb 15 oz baby boy with APGAR scores of 8 and 9 at 1 and 5 minutes, respectively. Which of the following structures is responsible for inhibition of female internal genitalia?",Sertoli cells,"{ ""A"": ""Spermatogonia"", ""B"": ""Allantois"", ""C"": ""Syncytiotrophoblast"", ""D"": ""Sertoli cells"" }",D
"A 43-year-old woman presents to the emergency department complaining of palpitations, dry cough, and shortness of breath for 1 week. She immigrated to the United States from Korea at the age of 20. She says that her heart is racing and she has never felt these symptoms before. Her cough is dry and is associated with shortness of breath that occurs with minimal exertion. Her past medical history is otherwise unremarkable. She has no allergies and is not currently taking any medications. She is a nonsmoker and an occasional drinker. She denies illicit drug use. Her blood pressure is 100/65 mm Hg, pulse is 76/min, respiratory rate is 23/min, and temperature is 36.8°C (98.2°F). Her physical examination is significant for bibasilar lung crackles and a non-radiating, low-pitched, mid-diastolic rumbling murmur best heard at the apical region. In addition, she has jugular vein distention and bilateral pitting edema in her lower extremities. Which of the following best describes the infectious agent that led to this patient’s condition?",A bacterium that induces complete lysis of the red cells of a blood agar plate with an oxygen-sensitive cytotoxin,"{ ""A"": ""A bacterium that induces partial lysis of red cells with hydrogen peroxide"", ""B"": ""A bacterium that induces complete lysis of the red cells of a blood agar plate with an oxygen-sensitive cytotoxin"", ""C"": ""A bacterium that induces heme degradation of the red cells of a blood agar plate"", ""D"": ""A bacterium that requires an anaerobic environment to grow properly"" }",B
"A male neonate is being examined by a pediatrician. His mother informs the doctor that she had a mild fever with rash, muscle pain, and swollen and tender lymph nodes during the second month of gestation. The boy was born at 39 weeks gestation via spontaneous vaginal delivery with no prenatal care. On physical examination, the neonate has normal vital signs. Retinal examination reveals the findings shown in the image. Which of the following congenital heart defects is most likely to be present in this neonate?",Patent ductus arteriosus,"{ ""A"": ""Atrial septal defect"", ""B"": ""Ventricular septal defect"", ""C"": ""Tetralogy of Fallot"", ""D"": ""Patent ductus arteriosus"" }",D
"A 4-year-old boy is brought to the emergency department by his parents. He is lethargic and confused and has a severe headache, vomiting, and a high-grade fever since earlier that day. His mother reports that the child was doing well until 2 days ago when he developed a fever and green nasal discharge. The patient has a history of neonatal sepsis, meningococcemia at 18 months of age, and pneumococcal pneumonia at 2 and 3 years of age. His scheduled vaccinations are up to date. His blood pressure is 70/50 mm Hg, heart rate is 120/min, respiratory rate is 22/min, and temperature is 39.3°C (102.4°F). On examination, the child is lethargic and his skin is pale, with several petechiae over his buttocks. There is a purulent nasal discharge from both nostrils. The lungs are clear to auscultation bilaterally. Heart sounds are normal. There is marked neck rigidity. Cerebrospinal fluid analysis shows the following results: Opening pressure 100 mm H2O Appearance cloudy Protein 500 mg/dL (5 g/L) White blood cells 2500/μL (polymorphonuclear predominance) Protein 450 mg/dL (4.5 g/L) Glucose 31 mg/dL (1.7 mmol/L) Culture positive for N. meningitidis Which of the following immunological processes is most likely to be impaired in this child?",Formation of C5-9 complex,"{ ""A"": ""Production of IL-2 by Th1 cells"", ""B"": ""Activation of TCRs by MHC-II"", ""C"": ""Formation of C5-9 complex"", ""D"": ""Cleavage of C2 component of complement into C2a and C2b"" }",C
"A 66-year-old woman with chronic obstructive pulmonary disease is brought to the emergency department because of fever, body aches, malaise, and a dry cough. She has smoked one pack of cigarettes daily for 30 years but quit smoking 1 year ago. She lives with her daughter and her granddaughter, who attends daycare. Her temperature is 38.1°C (101°F). Physical examination shows bilateral conjunctivitis, rhinorrhea, and erythematous tonsils without exudates. Further testing confirms infection with an enveloped orthomyxovirus. Administration of a drug with which of the following mechanisms of action is most appropriate?",Inhibition of neuraminidase,"{ ""A"": ""Inhibition of nucleoside reverse transcriptase"", ""B"": ""Inhibition of proton translocation"", ""C"": ""Inhibition of neuraminidase"", ""D"": ""Inhibition of protease"" }",C
"A 38-year-old woman undergoes hemithyroidectomy for treatment of localized, well-differentiated papillary thyroid carcinoma. The lesion is removed with clear margins. However, during the surgery, a structure lying directly adjacent to the superior thyroid artery at the upper pole of the thyroid lobe is damaged. This patient is most likely to experience which of the following symptoms?",Voice pitch limitation,"{ ""A"": ""Voice pitch limitation"", ""B"": ""Ineffective cough"", ""C"": ""Weakness of shoulder shrug"", ""D"": ""Shortness of breath"" }",A
"A 27-year-old man presents to the emergency room with persistent fever, nausea, and vomiting for the past 3 days. While waiting to be seen, he quickly becomes disoriented and agitated. Upon examination, he has visible signs of difficulty breathing with copious oral secretions and generalized muscle twitching. The patient’s temperature is 104°F (40°C), blood pressure is 90/64 mmHg, pulse is 88/min, and respirations are 18/min with an oxygen saturation of 90% on room air. When the nurse tries to place a nasal cannula, the patient becomes fearful and combative. The patient is sedated and placed on mechanical ventilation. Which of the following is a risk factor for the patient’s most likely diagnosis?",Spelunking,"{ ""A"": ""Contaminated beef"", ""B"": ""Epiglottic cyst"", ""C"": ""Mosquito bite"", ""D"": ""Spelunking"" }",D
"A 21-year-old man presents to the emergency department after sustaining a stab wound to the neck at a local farmer's market. The patient is otherwise healthy and is complaining of pain. The patient is able to offer the history himself. His temperature is 97.6°F (36.4°C), blood pressure is 120/84 mmHg, pulse is 90/min, respirations are 15/min, and oxygen saturation is 98% on room air. Physical exam demonstrates a 3 cm laceration 1 cm inferior to the mastoid process on the right side. The patient's breath sounds are clear and he is protecting his airway. No stridor or difficulty breathing is noted. Which of the following is the most appropriate next step in the management of this patient?",CT angiogram,"{ ""A"": ""CT angiogram"", ""B"": ""Intubation"", ""C"": ""Observation and blood pressure monitoring"", ""D"": ""Surgical exploration"" }",A
"A 13-year-old girl presents to a medical office for the evaluation of a lump on the front of her neck. The patient denies pain, but states that the mass bothers her because “it moves when I swallow”. The physical examination reveals a midline neck mass that is above the hyoid bone but below the level of the mandible. The mass is minimally mobile and feels fluctuant without erythema. The patient is afebrile and all vital signs are stable. A complete blood count and thyroid function tests are performed and are within normal limits. What is the most likely cause of this patient’s presentation?",Cyst formation in a persistent thyroglossal duct,"{ ""A"": ""Persistent thyroid tissue at the tongue base"", ""B"": ""Deletion of the 22q11 gene"", ""C"": ""Cyst formation in a persistent thyroglossal duct"", ""D"": ""Lymph node enlargement"" }",C
"A 35-year-old woman with a history of Crohn disease presents for a follow-up appointment. She says that lately, she has started to notice difficulty walking. She says that some of her friends have joked that she appears to be walking as if she was drunk. Past medical history is significant for Crohn disease diagnosed 2 years ago, managed with natalizumab for the past year because her intestinal symptoms have become severe and unresponsive to other therapies. On physical examination, there is gait and limb ataxia present. Strength is 4/5 in the right upper limb. A T1/T2 MRI of the brain is ordered and is shown. Which of the following is the most likely diagnosis?",Progressive multifocal encephalopathy (PML),"{ ""A"": ""Sporadic Creutzfeldt-Jakob disease (sCJD)"", ""B"": ""Variant Creutzfeldt-Jakob disease (vCJD)"", ""C"": ""Subacute sclerosing panencephalitis (SSPE)"", ""D"": ""Progressive multifocal encephalopathy (PML)"" }",D
"A 23-year-old G1 at 10 weeks gestation based on her last menstrual period is brought to the emergency department by her husband due to sudden vaginal bleeding. She says that she has mild lower abdominal cramps and is feeling dizzy and weak. Her blood pressure is 100/60 mm Hg, the pulse is 100/min, and the respiration rate is 15/min. She says that she has had light spotting over the last 3 days, but today the bleeding increased markedly and she also noticed the passage of clots. She says that she has changed three pads since the morning. She has also noticed that the nausea she was experiencing over the past few days has subsided. The physician examines her and notes that the cervical os is open and blood is pooling in the vagina. Products of conception can be visualized in the os. The patient is prepared for a suction curettage. Which of the following is the most likely cause for the pregnancy loss?",Chromosomal abnormalities,"{ ""A"": ""Rh immunization"", ""B"": ""Antiphospholipid syndrome"", ""C"": ""Chromosomal abnormalities"", ""D"": ""Trauma"" }",C
"An 8-month-old boy is brought to a medical office by his mother. The mother states that the boy has been very fussy and has not been feeding recently. The mother thinks the baby has been gaining weight despite not feeding well. The boy was delivered vaginally at 39 weeks gestation without complications. On physical examination, the boy is noted to be crying in his mother’s arms. There is no evidence of cyanosis, and the cardiac examination is within normal limits. The crying intensifies when the abdomen is palpated. The abdomen is distended with tympany in the left lower quadrant. You suspect a condition caused by the failure of specialized cells to migrate. What is the most likely diagnosis?",Hirschsprung disease,"{ ""A"": ""Meckel diverticulum"", ""B"": ""DiGeorge syndrome"", ""C"": ""Duodenal atresia"", ""D"": ""Hirschsprung disease"" }",D
"A 60-year-old man seeks evaluation at a medical office due to leg pain while walking. He says the pain starts in his buttocks and extends to his thighs and down to his calves. Previously, the pain resolved with rest, but the pain now persists in his feet, even during rest. His past medical history is significant for diabetes mellitus, hypertension, and cigarette smoking. The vital signs are within normal limits. The physical examination shows an atrophied leg with bilateral loss of hair. Which of the following is the most likely cause of this patient’s condition?",Narrowing and calcification of vessels,"{ ""A"": ""Decreased permeability of endothelium"", ""B"": ""Narrowing and calcification of vessels"", ""C"": ""Peripheral emboli formation"", ""D"": ""Weakening of vessel wall"" }",B
"A 52-year-old man presents to the emergency department with chest pain radiating to his left jaw and arm. He states that he had experienced similar symptoms when playing basketball. The medical history is significant for diabetes mellitus, hypertension, and GERD, for which he takes metformin, hydrochlorothiazide, and pantoprazole, respectively. The blood pressure is 150/90 mm Hg, the pulse is 100/min, and the respirations are 15/min. The ECG reveals ST elevation in leads V3-V6. He is hospitalized for an acute MI and started on treatment. The next day he complains of dizziness and blurred vision. Repeat vital signs were as follows: blood pressure 90/60 mm Hg, pulse 72/min, and respirations 12/min. The laboratory results were as follows: Serum chemistry Sodium 143 mEq/L Potassium 4.1 mEq/L Chloride 98 mEq/L Bicarbonate 22 mEq/L Blood urea nitrogen 26 mg/dL Creatinine 2.3 mg/dL Glucose 120 mg/dL Which of the following drugs is responsible for this patient’s lab abnormalities?",Lisinopril,"{ ""A"": ""Digoxin"", ""B"": ""Pantoprazole"", ""C"": ""Lisinopril"", ""D"": ""Nitroglycerin"" }",C
"A 28-year-old woman is brought to the hospital by her boyfriend. She has had three days of fever and headache followed by one day of worsening confusion and hallucinations. She also becomes agitated when offered water. Her temperature is 101°F (38.3°C). Two months prior to presentation, the couple was camping and encountered bats in their cabin. In addition to an injection shortly after exposure, what would have been the most effective treatment for this patient?",A killed vaccine within ten days of exposure,"{ ""A"": ""A killed vaccine within ten days of exposure"", ""B"": ""Oseltamivir within one week of exposure"", ""C"": ""Venom antiserum within hours of exposure"", ""D"": ""Doxycycline for one month after exposure"" }",A
A 60-year-old man comes to the physician for an examination prior to a scheduled cholecystectomy. He has hypertension treated with hydrochlorothiazide. His mother had chronic granulomatous disease of the lung. He works in a glass manufacturing plant. He has smoked two packs of cigarettes daily for 38 years. His vital signs are within normal limits. Examination shows no abnormalities. Laboratory studies are within the reference range. An x-ray of the chest is shown. Which of the following is the most appropriate next step in management?,Request previous chest x-ray,"{ ""A"": ""Perform arterial blood gas analysis"", ""B"": ""Perform CT-guided biopsy"", ""C"": ""Measure angiotensin-converting enzyme"", ""D"": ""Request previous chest x-ray"" }",D
"You are examining a 3-day-old newborn who was delivered vaginally without any complications. The newborn presents with vomiting, hyperventilation, lethargy, and seizures. Blood work demonstrates hyperammonemia, elevated glutamine levels, and decreased blood urea nitrogen. A CT scan demonstrates cerebral edema. Defects in which of the following enzymes would result in a clinical presentation similar to this infant?",Carbamoyl phosphate synthetase I,"{ ""A"": ""Phenylalanine hydroxylase"", ""B"": ""Branched-chain ketoacid dehydrogenase"", ""C"": ""Cystathionine synthase"", ""D"": ""Carbamoyl phosphate synthetase I"" }",D
"A 48-year-old man with HIV comes to the physician because of skin lesions over his face and neck for 2 weeks. They are not itchy or painful. He does not have fever or a sore throat. He was treated for candidal esophagitis 3 months ago. He is sexually active with his wife, who knows of his condition, and uses condoms consistently. He is currently receiving triple antiretroviral therapy with lamivudine, abacavir, and efavirenz. He is 175 cm (5 ft 9 in) tall and weighs 58 kg (128 lb); BMI is 18.8 kg/m2. Examination shows multiple skin colored papules over his face and neck with a dimpled center. Cervical lymphadenopathy is present. The remainder of the examination is unremarkable. His hemoglobin concentration is 12.1 g/dL, leukocyte count is 4,900/mm3, and platelet count is 143,000/mm3; serum studies and urinalysis show no abnormalities. CD4+ T-lymphocyte count is 312/mm3 (normal ≥ 500). Which of the following is the most likely cause of this patient's findings?",Poxvirus,"{ ""A"": ""Bartonella"", ""B"": ""Papillomavirus"", ""C"": ""Poxvirus"", ""D"": ""Coccidioides\n\"""" }",C
"A 55-year-old man comes to the physician because of fatigue and worsening abdominal pain for 4 weeks. He also reports excessive night sweats and a 5.4-kg (12-lb) weight loss during this time. He has a neck swelling for 4 days. Physical examination shows a nontender, enlarged, and fixed supraclavicular lymph node. There is splenomegaly. A CT scan of the thorax and abdomen shows massively enlarged axillary, mediastinal, and cervical lymph nodes. Analysis of an excised cervical lymph node shows lymphocytes with a high proliferative index that stain positive for CD20. Which of the following is the most likely diagnosis?",Diffuse large B-cell lymphoma,"{ ""A"": ""Adult T-cell lymphoma"", ""B"": ""Burkitt lymphoma"", ""C"": ""Diffuse large B-cell lymphoma"", ""D"": ""Hodgkin lymphoma"" }",C
"A 26-year-old G1P0 woman at 32-weeks gestation presents for follow-up ultrasound. She was diagnosed with gestational diabetes during her second trimester, but admits to poor glucose control and non-adherence to insulin therapy. Fetal ultrasound reveals an asymmetric, enlarged interventricular septum, left ventricular outflow tract obstruction, and significantly reduced ejection fraction. Which of the following is the most appropriate step in management after delivery?",Medical management,"{ ""A"": ""Emergent open fetal surgery"", ""B"": ""Cardiac magnetic resonance imaging"", ""C"": ""Cardiac catheterization"", ""D"": ""Medical management"" }",D
