question,answer,options,answer_idx
"A 23-year-old pregnant woman at 22 weeks gestation presents with burning upon urination. She states it started 1 day ago and has been worsening despite drinking more water and taking cranberry extract. She otherwise feels well and is followed by a doctor for her pregnancy. Her temperature is 97.7°F (36.5°C), blood pressure is 122/77 mmHg, pulse is 80/min, respirations are 19/min, and oxygen saturation is 98% on room air. Physical exam is notable for an absence of costovertebral angle tenderness and a gravid uterus. Which of the following is the best treatment for this patient?",Nitrofurantoin,"{ ""A"": ""Ampicillin"", ""B"": ""Ceftriaxone"", ""C"": ""Doxycycline"", ""D"": ""Nitrofurantoin"" }",D
A 3-month-old baby died suddenly at night while asleep. His mother noticed that he had died only after she awoke in the morning. No cause of death was determined based on the autopsy. Which of the following precautions could have prevented the death of the baby?,Placing the infant in a supine position on a firm mattress while sleeping,"{ ""A"": ""Placing the infant in a supine position on a firm mattress while sleeping"", ""B"": ""Keeping the infant covered and maintaining a high room temperature"", ""C"": ""Application of a device to maintain the sleeping position"", ""D"": ""Avoiding pacifier use during sleep"" }",A
"A mother brings her 3-week-old infant to the pediatrician's office because she is concerned about his feeding habits. He was born without complications and has not had any medical problems up until this time. However, for the past 4 days, he has been fussy, is regurgitating all of his feeds, and his vomit is yellow in color. On physical exam, the child's abdomen is minimally distended but no other abnormalities are appreciated. Which of the following embryologic errors could account for this presentation?",Abnormal migration of ventral pancreatic bud,"{ ""A"": ""Abnormal migration of ventral pancreatic bud"", ""B"": ""Complete failure of proximal duodenum to recanalize"", ""C"": ""Abnormal hypertrophy of the pylorus"", ""D"": ""Failure of lateral body folds to move ventrally and fuse in the midline"" }",A
"A pulmonary autopsy specimen from a 58-year-old woman who died of acute hypoxic respiratory failure was examined. She had recently undergone surgery for a fractured femur 3 months ago. Initial hospital course was uncomplicated, and she was discharged to a rehab facility in good health. Shortly after discharge home from rehab, she developed sudden shortness of breath and had cardiac arrest. Resuscitation was unsuccessful. On histological examination of lung tissue, fibrous connective tissue around the lumen of the pulmonary artery is observed. Which of the following is the most likely pathogenesis for the present findings?",Thromboembolism,"{ ""A"": ""Thromboembolism"", ""B"": ""Pulmonary ischemia"", ""C"": ""Pulmonary hypertension"", ""D"": ""Pulmonary passive congestion"" }",A
"A 20-year-old woman presents with menorrhagia for the past several years. She says that her menses “have always been heavy”, and she has experienced easy bruising for as long as she can remember. Family history is significant for her mother, who had similar problems with bruising easily. The patient's vital signs include: heart rate 98/min, respiratory rate 14/min, temperature 36.1°C (96.9°F), and blood pressure 110/87 mm Hg. Physical examination is unremarkable. Laboratory tests show the following: platelet count 200,000/mm3, PT 12 seconds, and PTT 43 seconds. Which of the following is the most likely cause of this patient’s symptoms?",Von Willebrand disease,"{ ""A"": ""Hemophilia A"", ""B"": ""Lupus anticoagulant"", ""C"": ""Protein C deficiency"", ""D"": ""Von Willebrand disease"" }",D
"A 40-year-old zookeeper presents to the emergency department complaining of severe abdominal pain that radiates to her back, and nausea. The pain started 2 days ago and slowly increased until she could not tolerate it any longer. Past medical history is significant for hypertension and hypothyroidism. Additionally, she reports that she was recently stung by one of the zoo’s smaller scorpions, but did not seek medical treatment. She takes aspirin, levothyroxine, oral contraceptive pills, and a multivitamin daily. Family history is noncontributory. Today, her blood pressure is 108/58 mm Hg, heart rate is 99/min, respiratory rate is 21/min, and temperature is 37.0°C (98.6°F). On physical exam, she is a well-developed, obese female that looks unwell. Her heart has a regular rate and rhythm. Radial pulses are weak but symmetric. Her lungs are clear to auscultation bilaterally. Her lateral left ankle is swollen, erythematous, and painful to palpate. An abdominal CT is consistent with acute pancreatitis. Which of the following is the most likely etiology for this patient’s disease?",Scorpion sting,"{ ""A"": ""Aspirin"", ""B"": ""Oral contraceptive pills"", ""C"": ""Scorpion sting"", ""D"": ""Hypothyroidism"" }",C
"A 25-year-old primigravida presents to her physician for a routine prenatal visit. She is at 34 weeks gestation, as confirmed by an ultrasound examination. She has no complaints, but notes that the new shoes she bought 2 weeks ago do not fit anymore. The course of her pregnancy has been uneventful and she has been compliant with the recommended prenatal care. Her medical history is unremarkable. She has a 15-pound weight gain since the last visit 3 weeks ago. Her vital signs are as follows: blood pressure, 148/90 mm Hg; heart rate, 88/min; respiratory rate, 16/min; and temperature, 36.6℃ (97.9℉). The blood pressure on repeat assessment 4 hours later is 151/90 mm Hg. The fetal heart rate is 151/min. The physical examination is significant for 2+ pitting edema of the lower extremity. Which of the following tests o should confirm the probable condition of this patient?",24-hour urine protein,"{ ""A"": ""Bilirubin assessment"", ""B"": ""Coagulation studies"", ""C"": ""Leukocyte count with differential"", ""D"": ""24-hour urine protein"" }",D
A 3900-g (8.6-lb) male infant is delivered at 39 weeks' gestation via spontaneous vaginal delivery. Pregnancy and delivery were uncomplicated but a prenatal ultrasound at 20 weeks showed a defect in the pleuroperitoneal membrane. Further evaluation of this patient is most likely to show which of the following findings?,Gastric fundus in the thorax,"{ ""A"": ""Gastric fundus in the thorax"", ""B"": ""Pancreatic ring around the duodenum"", ""C"": ""Hypertrophy of the gastric pylorus"", ""D"": ""Large bowel in the inguinal canal"" }",A
"A 62-year-old woman presents for a regular check-up. She complains of lightheadedness and palpitations which occur episodically. Past medical history is significant for a myocardial infarction 6 months ago and NYHA class II chronic heart failure. She also was diagnosed with grade I arterial hypertension 4 years ago. Current medications are aspirin 81 mg, atorvastatin 10 mg, enalapril 10 mg, and metoprolol 200 mg daily. Her vital signs are a blood pressure of 135/90 mm Hg, a heart rate of 125/min, a respiratory rate of 14/min, and a temperature of 36.5°C (97.7°F). Cardiopulmonary examination is significant for irregular heart rhythm and decreased S1 intensity. ECG is obtained and is shown in the picture (see image). Echocardiography shows a left ventricular ejection fraction of 39%. Which of the following drugs is the best choice for rate control in this patient?",Digoxin,"{ ""A"": ""Atenolol"", ""B"": ""Diltiazem"", ""C"": ""Propafenone"", ""D"": ""Digoxin"" }",D
A 35-year-old male presents to his primary care physician with complaints of seasonal allergies. He has been using intranasal vasoconstrictors several times per day for several weeks. What is a likely sequela of the chronic use of topical nasal decongestants?,Persistent congestion,"{ ""A"": ""Epistaxis"", ""B"": ""Permanent loss of smell"", ""C"": ""Persistent nasal crusting"", ""D"": ""Persistent congestion"" }",D
"A 46-year-old woman comes to the physician because of a 2-week history of diplopia and ocular pain when reading the newspaper. She also has a 3-month history of amenorrhea, hot flashes, and increased sweating. She reports that she has been overweight all her adult life and is happy to have lost 6.8-kg (15-lb) of weight in the past 2 months. Her pulse is 110/min, and blood pressure is 148/98 mm Hg. Physical examination shows moist palms and a nontender thyroid gland that is enlarged to two times its normal size. Ophthalmologic examination shows prominence of the globes of the eyes, bilateral lid retraction, conjunctival injection, and an inability to converge the eyes. There is no pain on movement of the extraocular muscles. Visual acuity is 20/20 bilaterally. Neurologic examination shows a fine resting tremor of the hands. Deep tendon reflexes are 3+ with a shortened relaxation phase. Which of the following is the most likely cause of this patient's ocular complaints?",Glycosaminoglycan accumulation in the orbit,"{ ""A"": ""Granulomatous inflammation of the cavernous sinus"", ""B"": ""Abnormal communication between the cavernous sinus and the internal carotid artery"", ""C"": ""Glycosaminoglycan accumulation in the orbit"", ""D"": ""Sympathetic hyperactivity of levator palpebrae superioris\n\"""" }",C
"A 1-year-old boy presents to the emergency department with weakness and a change in his behavior. His parents state that they first noticed the change in his behavior this morning and it has been getting worse. They noticed the patient was initially weak in his upper body and arms, but now he won’t move his legs with as much strength or vigor as he used to. Physical exam is notable for bilateral ptosis with a sluggish pupillary response, a very weak sucking and gag reflex, and shallow respirations. The patient is currently drooling and his diaper is dry. The parents state he has not had a bowel movement in over 1 day. Which of the following is the pathophysiology of this patient’s condition?",Blockade of presynaptic acetylcholine release at the neuromuscular junction,"{ ""A"": ""Autoantibodies against the presynaptic voltage-gated calcium channels"", ""B"": ""Autoimmune demyelination of peripheral nerves"", ""C"": ""Blockade of presynaptic acetylcholine release at the neuromuscular junction"", ""D"": ""Lower motor neuron destruction in the anterior horn"" }",C
"A 9-month-old female is brought to the emergency department after experiencing a seizure. She was born at home and was normal at birth according to her parents. Since then, they have noticed that she does not appear to be achieving developmental milestones as quickly as her siblings, and often appears lethargic. Physical exam reveals microcephaly, very light pigmentation (as compared to her family), and a ""musty"" body odor. The varied manifestations of this disease can most likely be attributed to which of the following genetic principles?",Pleiotropy,"{ ""A"": ""Anticipation"", ""B"": ""Multiple gene mutations"", ""C"": ""Pleiotropy"", ""D"": ""Variable expressivity"" }",C
"A 23-year-old man comes to the physician for evaluation of decreased hearing, dizziness, and ringing in his right ear for the past 6 months. Physical examination shows multiple soft, yellow plaques and papules on his arms, chest, and back. There is sensorineural hearing loss and weakness of facial muscles bilaterally. His gait is unsteady. An MRI of the brain shows a 3-cm mass near the right internal auditory meatus and a 2-cm mass at the left cerebellopontine angle. The abnormal cells in these masses are most likely derived from which of the following embryological structures?",Neural crest,"{ ""A"": ""Neural tube"", ""B"": ""Surface ectoderm"", ""C"": ""Neural crest"", ""D"": ""Notochord"" }",C
"A 62-year-old woman comes to the physician because of coughing and fatigue during the past 2 years. In the morning, the cough is productive of white phlegm. She becomes short of breath walking up a flight of stairs. She has hypertension and hyperlipidemia. She has recently retired from working as a nurse at a homeless shelter. She has smoked 1 pack of cigarettes daily for 40 years. Current medications include ramipril and fenofibrate. Her temperature is 36.5°C (97.7°F), respirations are 24/min, pulse is 85/min, and blood pressure is 140/90 mm Hg. Scattered wheezing and rhonchi are heard throughout both lung fields. There are no murmurs, rubs, or gallops but heart sounds are distant. Which of the following is the most likely underlying cause of this patient's symptoms?",Progressive obstruction of expiratory airflow,"{ ""A"": ""Chronic decrease in pulmonary compliance"", ""B"": ""Local accumulation of kinins"", ""C"": ""Progressive obstruction of expiratory airflow"", ""D"": ""Incremental loss of functional residual capacity\n\"""" }",C
"A 68-year-old man presents to the emergency department with leg pain. He states that the pain started suddenly while he was walking outside. The patient has a past medical history of diabetes, hypertension, obesity, and atrial fibrillation. His temperature is 99.3°F (37.4°C), blood pressure is 152/98 mmHg, pulse is 97/min, respirations are 15/min, and oxygen saturation is 99% on room air. Physical exam is notable for a cold and pale left leg. The patient’s sensation is markedly diminished in the left leg when compared to the right, and his muscle strength is 1/5 in his left leg. Which of the following is the best next step in management?",Heparin drip,"{ ""A"": ""Graded exercise and aspirin"", ""B"": ""Heparin drip"", ""C"": ""Surgical thrombectomy"", ""D"": ""Tissue plasminogen activator"" }",B
"A 76-year-old African American man presents to his primary care provider complaining of urinary frequency. He wakes up 3-4 times per night to urinate while he previously only had to wake up once per night. He also complains of post-void dribbling and difficulty initiating a stream of urine. He denies any difficulty maintaining an erection. His past medical history is notable for non-alcoholic fatty liver disease, hypertension, hyperlipidemia, and gout. He takes aspirin, atorvastatin, enalapril, and allopurinol. His family history is notable for prostate cancer in his father and lung cancer in his mother. He has a 15-pack-year smoking history and drinks alcohol socially. On digital rectal exam, his prostate is enlarged, smooth, and non-tender. Which of the following medications is indicated in this patient?",Tamsulosin,"{ ""A"": ""Hydrochlorothiazide"", ""B"": ""Midodrine"", ""C"": ""Oxybutynin"", ""D"": ""Tamsulosin"" }",D
"A 68-year-old man comes to the physician because of recurrent episodes of nausea and abdominal discomfort for the past 4 months. The discomfort is located in the upper abdomen and sometimes occurs after eating, especially after a big meal. He has tried to go for a walk after dinner to help with digestion, but his complaints have only increased. For the past 3 weeks he has also had symptoms while climbing the stairs to his apartment. He has type 2 diabetes mellitus, hypertension, and stage 2 peripheral arterial disease. He has smoked one pack of cigarettes daily for the past 45 years. He drinks one to two beers daily and occasionally more on weekends. His current medications include metformin, enalapril, and aspirin. He is 168 cm (5 ft 6 in) tall and weighs 126 kg (278 lb); BMI is 45 kg/m2. His temperature is 36.4°C (97.5°F), pulse is 78/min, and blood pressure is 148/86 mm Hg. On physical examination, the abdomen is soft and nontender with no organomegaly. Foot pulses are absent bilaterally. An ECG shows no abnormalities. Which of the following is the most appropriate next step in diagnosis?",Cardiac stress test,"{ ""A"": ""Esophagogastroduodenoscopy"", ""B"": ""Hydrogen breath test"", ""C"": ""Cardiac stress test"", ""D"": ""Abdominal ultrasonography of the right upper quadrant"" }",C
A 27-year-old female presents to general medical clinic for a routine checkup. She has a genetic disease marked by a mutation in a chloride transporter. She has a history of chronic bronchitis. She has a brother with a similar history of infections as well as infertility. Which of the following is most likely true regarding a potential vitamin deficiency complication secondary to this patient's chronic illness?,It may manifest itself as a prolonged PT,"{ ""A"": ""It may result in corneal vascularization"", ""B"": ""It may result in the triad of confusion, ophthalmoplegia, and ataxia"", ""C"": ""It may be exacerbated by excessive ingestion of raw eggs"", ""D"": ""It may manifest itself as a prolonged PT"" }",D
A previously healthy 36-year-old man comes to the physician for a yellow discoloration of his skin and dark-colored urine for 2 weeks. He does not drink any alcohol. Physical examination shows jaundice. Abdominal and neurologic examinations show no abnormalities. Serum studies show increased levels of alanine aminotransferase (ALT) and aspartate aminotransferase (AST). A liver biopsy is performed and a photomicrograph after periodic acid-Schiff-staining is shown. Which of the following is the most likely additional finding in this patient?,Bullous changes of the lung bases on chest CT,"{ ""A"": ""Bullous changes of the lung bases on chest CT"", ""B"": ""Beading of intra- and extrahepatic bile ducts on ERCP"", ""C"": ""Myocardial iron deposition on cardiovascular MRI"", ""D"": ""Dark corneal ring on slit-lamp examination"" }",A
"A 69-year-old male presents to the emergency room with back pain. He has a history of personality disorder and metastatic prostate cancer and was not a candidate for surgical resection. He began chemotherapy but discontinued due to unremitting nausea. He denies any bowel or bladder incontinence. He has never had pain like this before and is demanding morphine. The nurse administers IV morphine and he feels more comfortable. Vital signs are stable. On physical examination you note tenderness to palpation along the lower spine, weakness in the bilateral lower extremities, left greater than right. Neurological examination is also notable for hyporeflexia in the knee and ankle jerks bilaterally. You conduct a rectal examination, which reveals saddle anesthesia. Regarding this patient, what is the most likely diagnosis and the appropriate next step in management?",The most likely diagnosis is cauda equina syndrome and steroids should be started prior to MRI,"{ ""A"": ""The most likely diagnosis is cauda equina syndrome and steroids should be started prior to MRI"", ""B"": ""The most likely diagnosis is cauda equina syndrome and steroids should be started after to MRI"", ""C"": ""The most likely diagnosis is cauda equina syndrome and the patient should be rushed to radiation"", ""D"": ""The most likely diagnosis is conus medullaris syndrome and steroids should be started prior to MRI"" }",A
"An investigator is studying the function of the lateral nucleus of the hypothalamus in an experimental animal. Using a viral vector, the genes encoding chloride-conducting channelrhodopsins are injected into this nucleus. Photostimulation of the channels causes complete inhibition of action potential generation. Persistent photostimulation is most likely to result in which of the following abnormalities in these animals?",Anorexia,"{ ""A"": ""Hypothermia"", ""B"": ""Hyperthermia"", ""C"": ""Polydipsia"", ""D"": ""Anorexia"" }",D
"A 52-year-old woman comes to the physician because of a 6-month history of generalized fatigue, low-grade fever, and a 10-kg (22-lb) weight loss. Physical examination shows generalized pallor and splenomegaly. Her hemoglobin concentration is 7.5 g/dL and leukocyte count is 41,800/mm3. Leukocyte alkaline phosphatase activity is low. Peripheral blood smear shows basophilia with myelocytes and metamyelocytes. Bone marrow biopsy shows cellular hyperplasia with proliferation of immature granulocytic cells. Which of the following mechanisms is most likely responsible for this patient's condition?",Unregulated expression of the ABL1 gene,"{ ""A"": ""Cytokine-independent activation of the JAK-STAT pathway"", ""B"": ""Loss of function of the APC gene"", ""C"": ""Altered expression of the retinoic acid receptor gene"", ""D"": ""Unregulated expression of the ABL1 gene"" }",D
"A 42-year-old woman is in the hospital recovering from a cholecystectomy performed 3 days ago that was complicated by cholangitis. She is being treated with IV piperacillin-tazobactam. She calls the nurse to her room because she says that her heart is racing. She also demands that someone come in to clean the pile of garbage off of the floor because it is attracting flies. Her pulse is 112/min, respiratory rate is 20/min, temperature is 38.0°C (100.4°F), and blood pressure is 150/90 mm Hg. On physical examination, the patient appears sweaty, distressed, and unable to remain still. She is oriented to person, but not place or time. Palpation of the abdomen shows no tenderness, rebound, or guarding. Which of the following is the most likely diagnosis in this patient?",Delirium tremens,"{ ""A"": ""Acute cholangitis"", ""B"": ""Alcoholic hallucinosis"", ""C"": ""Delirium tremens"", ""D"": ""Hepatic encephalopathy"" }",C
"A 48-year-old woman comes to the emergency department because of a photosensitive blistering rash on her hands, forearms, and face for 3 weeks. The lesions are not itchy. She has also noticed that her urine has been dark brown in color recently. Twenty years ago, she was successfully treated for Coats disease of the retina via retinal sclerotherapy. She is currently on hormonal replacement therapy for perimenopausal symptoms. Her aunt and sister have a history of a similar skin lesions. Examination shows multiple fluid-filled blisters and oozing erosions on the forearms, dorsal side of both hands, and forehead. There is hyperpigmented scarring and patches of bald skin along the sides of the blisters. Laboratory studies show a normal serum ferritin concentration. Which of the following is the most appropriate next step in management to induce remission in this patient?",Begin phlebotomy therapy,"{ ""A"": ""Pursue liver transplantation"", ""B"": ""Begin oral thalidomide therapy"", ""C"": ""Begin phlebotomy therapy"", ""D"": ""Begin oral hydroxychloroquine therapy"" }",C
"A 53-year-old man comes to the emergency department because of severe right-sided flank pain for 3 hours. The pain is colicky, radiates towards his right groin, and he describes it as 8/10 in intensity. He has vomited once. He has no history of similar episodes in the past. Last year, he was treated with naproxen for swelling and pain of his right toe. He has a history of hypertension. He drinks one to two beers on the weekends. Current medications include amlodipine. He appears uncomfortable. His temperature is 37.1°C (99.3°F), pulse is 101/min, and blood pressure is 130/90 mm Hg. Examination shows a soft, nontender abdomen and right costovertebral angle tenderness. An upright x-ray of the abdomen shows no abnormalities. A CT scan of the abdomen and pelvis shows a 7-mm stone in the proximal ureter and grade I hydronephrosis on the right. Which of the following is most likely to be seen on urinalysis?",Urinary pH: 4.7,"{ ""A"": ""Urinary pH: 7.3"", ""B"": ""Urinary pH: 4.7"", ""C"": ""Positive nitrites test"", ""D"": ""Largely positive urinary protein"" }",B
"A 5-year-old girl is brought to the clinic by her mother for excessive hair growth. Her mother reports that for the past 2 months she has noticed hair at the axillary and pubic areas. She denies any family history of precocious puberty and reports that her daughter has been relatively healthy with an uncomplicated birth history. She denies any recent illnesses, weight change, fever, vaginal bleeding, pain, or medication use. Physical examination demonstrates Tanner stage 4 development. A pelvic ultrasound shows an ovarian mass. Laboratory studies demonstrates an elevated level of estrogen. What is the most likely diagnosis?",Granulosa cell tumor,"{ ""A"": ""Granulosa cell tumor"", ""B"": ""Idiopathic precocious puberty"", ""C"": ""McCune-Albright syndrome"", ""D"": ""Sertoli-Leydig tumor"" }",A
"A 16-year-old boy is brought to the physician by his mother because she is worried about his behavior. Yesterday, he was expelled from school for repeatedly skipping classes. Over the past 2 months, he was suspended 3 times for bullying and aggressive behavior towards his peers and teachers. Once, his neighbor found him smoking cigarettes in his backyard. In the past, he consistently maintained an A grade average and had been a regular attendee of youth group events at their local church. The mother first noticed this change in behavior 3 months ago, around the time at which his father moved out after discovering his wife was having an affair. Which of the following defense mechanisms best describes the change in this patient's behavior?",Acting out,"{ ""A"": ""Acting out"", ""B"": ""Projection"", ""C"": ""Passive aggression"", ""D"": ""Regression"" }",A
"A 63-year-old woman presents to her primary-care doctor for a 2-month history of vision changes, specifically citing the gradual onset of double vision. Her double vision is present all the time and does not get better or worse throughout the day. She has also noticed that she has a hard time keeping her right eye open, and her right eyelid looks 'droopy' in the mirror. Physical exam findings during primary gaze are shown in the photo. Her right pupil is 6 mm and poorly reactive to light. The rest of her neurologic exam is unremarkable. Laboratory studies show an Hb A1c of 5.0%. Which of the following is the next best test for this patient?",MR angiography of the head,"{ ""A"": ""Direct fundoscopy"", ""B"": ""Intraocular pressures"", ""C"": ""MR angiography of the head"", ""D"": ""Temporal artery biopsy"" }",C
